{
  "$comment": "Vendored snapshot of the canonical aep-record schema from wasmagent-protocol (https://wasmagent.dev/schemas/aep/aep-record.schema.json). Pinned for the aep-record back-adapter conformance test so it runs without a checkout of wasmagent-protocol. Keep in sync with schemas/aep/aep-record.schema.json in WasmAgent/wasmagent-protocol.",
  "$schema": "https://json-schema.org/draft/2020-12/schema",
  "$id": "https://wasmagent.dev/schemas/aep/aep-record.schema.json",
  "title": "AEPRecord",
  "description": "Agent Evidence Protocol record — runtime action evidence and run provenance. Canonical source for wasmagent-js, wasmagent-proxy, trace-pipeline, wasmagent-train-replay, and open-agent-audit.",
  "type": "object",
  "required": ["schema_version", "run_id", "created_at_ms"],
  "properties": {
    "schema_version": { "type": "string", "enum": ["aep/v0.1", "aep/v0.2"] },
    "run_id": { "type": "string" },
    "trace_id": { "type": "string" },
    "parent_trace_id": { "type": ["string", "null"] },
    "repo_commit": { "type": "string" },
    "runtime_version": { "type": "string" },
    "model_provider": { "type": "string" },
    "model_id": { "type": "string" },
    "policy_bundle_digest": { "type": "string" },
    "tool_manifest_digest": { "type": "string" },
    "mcp_server_card_digest": { "type": ["string", "null"] },
    "input_refs": {
      "type": "array",
      "items": {
        "type": "object",
        "required": ["uri"],
        "properties": {
          "uri": { "type": "string" },
          "digest": { "type": "string" },
          "taint_labels": { "type": "array", "items": { "type": "string" } }
        }
      }
    },
    "output_refs": {
      "type": "array",
      "items": {
        "type": "object",
        "required": ["uri"],
        "properties": {
          "uri": { "type": "string" },
          "digest": { "type": "string" },
          "redaction_profile": { "type": "string" }
        }
      }
    },
    "capability_decisions": {
      "type": "array",
      "items": {
        "type": "object",
        "required": ["capability", "subject", "resource", "decision"],
        "properties": {
          "capability": { "type": "string" },
          "subject": { "type": "string" },
          "resource": { "type": "string" },
          "decision": { "type": "string", "enum": ["allow", "deny", "ask_user", "dry_run"] },
          "reason_code": { "type": "string" }
        }
      }
    },
    "actions": {
      "type": "array",
      "items": {
        "type": "object",
        "required": ["action_id", "tool_name", "state_changing", "timestamp_ms"],
        "properties": {
          "action_id": { "type": "string" },
          "tool_name": { "type": "string" },
          "state_changing": { "type": "boolean" },
          "precondition_digest": { "type": "string" },
          "result_digest": { "type": "string" },
          "evidence_refs": { "type": "array", "items": { "type": "string" } },
          "timestamp_ms": { "type": "number" },
          "parent_action_id": { "type": "string" },
          "causal_chain_id": { "type": "string" },
          "tool_descriptor_digest": { "type": "string" },
          "server_card_digest": { "type": "string" },
          "scope_lease_id": { "type": "string" },
          "approval_context_hash": { "type": "string" },
          "input_taint_labels": { "type": "array", "items": { "type": "string" } },
          "output_taint_labels": { "type": "array", "items": { "type": "string" } },
          "memory_read_refs": { "type": "array", "items": { "type": "string" } },
          "memory_write_refs": { "type": "array", "items": { "type": "string" } },
          "pre_state_digest": { "type": "string" },
          "post_state_digest": { "type": "string" }
        }
      }
    },
    "verifier_results": {
      "type": "array",
      "items": {
        "type": "object",
        "required": ["verifier_id", "passed"],
        "properties": {
          "verifier_id": { "type": "string" },
          "passed": { "type": "boolean" },
          "score": { "type": "number" },
          "claim_ids": { "type": "array", "items": { "type": "string" } }
        }
      }
    },
    "budget_ledger": {
      "type": "object",
      "description": "Per-run budget consumption vs limits",
      "properties": {
        "token_budget": {
          "type": "object",
          "required": ["spent"],
          "properties": {
            "limit": { "type": "number" },
            "spent": { "type": "number" }
          }
        },
        "latency_budget": {
          "type": "object",
          "required": ["actual_ms"],
          "properties": {
            "limit_ms": { "type": "number" },
            "actual_ms": { "type": "number" }
          }
        },
        "tool_budget": {
          "type": "object",
          "required": ["spent"],
          "properties": {
            "limit": { "type": "number" },
            "spent": { "type": "number" }
          }
        },
        "risk_budget": {
          "type": "object",
          "required": ["spent"],
          "properties": {
            "limit": { "type": "number" },
            "spent": { "type": "number" }
          }
        },
        "retry_budget": {
          "type": "object",
          "required": ["spent"],
          "properties": {
            "limit": { "type": "number" },
            "spent": { "type": "number" }
          }
        },
        "human_approval_budget": {
          "type": "object",
          "required": ["spent"],
          "properties": {
            "limit": { "type": "number" },
            "spent": { "type": "number" }
          }
        }
      }
    },
    "created_at_ms": { "type": "number" },
    "run_context": {
      "type": "object",
      "properties": {
        "agent_id": { "type": "string" },
        "agent_version": { "type": "string" },
        "subagent_id": { "type": "string" },
        "delegation_chain": { "type": "array", "items": { "type": "string" } },
        "environment_digest": { "type": "string" },
        "dependency_lock_digest": { "type": "string" }
      }
    },
    "signature": {
      "type": "object",
      "required": ["alg", "key_id", "sig"],
      "properties": {
        "alg": { "type": "string" },
        "key_id": { "type": "string" },
        "sig": { "type": "string" },
        "bundle": { "type": "object" },
        "transparency_log_ref": { "type": "string" }
      }
    }
  }
}
