{
  "schema_version": "aep/v0.2",
  "run_id": "run-bscode-fixture-001",
  "repo_commit": "abcdef1234567890abcdef1234567890abcdef12",
  "runtime_version": "bscode@0.4.2",
  "model_provider": "anthropic",
  "model_id": "claude-sonnet-4-6",
  "policy_bundle_digest": "eeeeeeeeeeeeeeeeeeeeeeeeeeeeeeeeeeeeeeeeeeeeeeeeeeeeeeeeeeeeeeee",
  "tool_manifest_digest": "ffffffffffffffffffffffffffffffffffffffffffffffffffffffffffffffff",
  "input_refs": [],
  "output_refs": [],
  "capability_decisions": [
    {
      "capability": "fs:write",
      "subject": "agent",
      "resource": "src/index.ts",
      "decision": "allow",
      "reason_code": "policy-allow-src"
    }
  ],
  "actions": [
    {
      "action_id": "action-0",
      "tool_name": "str_replace_editor",
      "state_changing": true,
      "evidence_refs": [],
      "timestamp_ms": 1700100000000,
      "input_taint_labels": ["user-supplied"],
      "output_taint_labels": ["filesystem"],
      "pre_state_digest": "1111111111111111111111111111111111111111111111111111111111111111",
      "post_state_digest": "2222222222222222222222222222222222222222222222222222222222222222"
    },
    {
      "action_id": "action-1",
      "tool_name": "bash",
      "state_changing": false,
      "evidence_refs": ["sha256:cafebabe"],
      "timestamp_ms": 1700100002000,
      "input_taint_labels": [],
      "output_taint_labels": []
    }
  ],
  "verifier_results": [
    {
      "verifier_id": "biome-lint-v1",
      "passed": true,
      "score": 1,
      "claim_ids": ["claim-lint-001"]
    }
  ],
  "budget_ledger": {
    "token_budget": { "limit": 50000, "spent": 12388 },
    "tool_budget": { "limit": 50, "spent": 2 }
  },
  "created_at_ms": 1700100003000,
  "signature": {
    "alg": "ed25519",
    "key_id": "bscode-aep-key-v1",
    "sig": "rfjP8HcbaSRRMeP4AuOW5QCrGbyQg63jRoPKzOe3dpYzjVYPGQTeYXCJfgn+2E/H8jo2ME7hPLLWZUN+xQdjAg=="
  }
}
